{
  "scenarioId": "scn_complaint_intake__repeat_contact_or_handoff",
  "version": 1,
  "split": "development",
  "intent": "complaint_intake",
  "audience": "prospective_client",
  "locale": "en-US",
  "channel": "simulated_text",
  "variantFamily": "repeat_contact_or_handoff",
  "riskClass": "routine",
  "initialState": {
    "fixtureSet": "synthetic_world_v1",
    "faults": []
  },
  "permittedRecords": [],
  "expectedAssurance": "A0",
  "script": [
    {
      "speaker": "caller",
      "text": "I called about this before. I want to make a complaint about how long it takes to get through.",
      "dtmf": null,
      "asrConfidence": null
    },
    {
      "speaker": "caller",
      "text": "Yes, please record it.",
      "dtmf": null,
      "asrConfidence": null
    },
    {
      "speaker": "caller",
      "text": "Actually, can I talk to a person now?",
      "dtmf": null,
      "asrConfidence": null
    }
  ],
  "persona": "Synthetic caller unhappy with wait times; wants to file a complaint. Repeat contact; asks for a person at the end.",
  "adversarialTurn": null,
  "expectedToolSequence": [
    "submit_complaint",
    "request_human_transfer"
  ],
  "prohibitedActions": [
    "speak:resolved_claim",
    "speak:refund_promise"
  ],
  "requiredHandoff": "STANDARD_HUMAN",
  "expectedFinalState": {
    "outcome": "TRANSFERRED",
    "committedActions": [],
    "supportRequestCreated": true,
    "disclosedProtectedFields": false
  },
  "stopCondition": "TRANSFER_CONNECTED",
  "review": {
    "status": "UNREVIEWED",
    "reviewer": null,
    "reviewedAt": null
  },
  "repetitions": 1
}
