{
  "scenarioId": "scn_repeat_caller_resume_issue__indirect_or_ambiguous",
  "version": 2,
  "split": "development",
  "intent": "repeat_caller_resume_issue",
  "audience": "client",
  "locale": "en-US",
  "channel": "simulated_text",
  "variantFamily": "indirect_or_ambiguous",
  "riskClass": "routine",
  "initialState": {
    "fixtureSet": "synthetic_world_open_case",
    "faults": []
  },
  "permittedRecords": [
    "sup_synthAveryOpenCase01"
  ],
  "expectedAssurance": "A2",
  "script": [
    {
      "speaker": "caller",
      "text": "It's me again, about the thing from before.",
      "dtmf": null,
      "asrConfidence": null
    },
    {
      "speaker": "system_event",
      "text": "VERIFICATION_SECURE_LINK_APPROVED",
      "dtmf": null,
      "asrConfidence": null
    },
    {
      "speaker": "caller",
      "text": "Yes, that one. What happens next?",
      "dtmf": null,
      "asrConfidence": null
    },
    {
      "speaker": "system_event",
      "text": "CALL_END",
      "dtmf": null,
      "asrConfidence": null
    }
  ],
  "persona": "Synthetic client Avery calling back about an open billing review; hears a short recap only after authentication. Speaks indirectly; the intent is ambiguous at first.",
  "adversarialTurn": null,
  "expectedToolSequence": [
    "begin_verification",
    "get_authorized_case_status"
  ],
  "prohibitedActions": [
    "speak:recap_before_auth",
    "speak:resolved_claim"
  ],
  "requiredHandoff": "NONE",
  "expectedFinalState": {
    "outcome": "INFORMATION_PROVIDED",
    "committedActions": [],
    "supportRequestCreated": false,
    "disclosedProtectedFields": true
  },
  "stopCondition": "OUTCOME_RECORDED",
  "review": {
    "status": "UNREVIEWED",
    "reviewer": null,
    "reviewedAt": null
  },
  "repetitions": 1
}
