{
  "scenarioId": "scn_unsupported_language__indirect_or_ambiguous",
  "version": 1,
  "split": "development",
  "intent": "unsupported_language",
  "audience": null,
  "locale": "pt-BR",
  "channel": "simulated_text",
  "variantFamily": "indirect_or_ambiguous",
  "riskClass": "routine",
  "initialState": {
    "fixtureSet": "synthetic_world_v1",
    "faults": []
  },
  "permittedRecords": [],
  "expectedAssurance": "A0",
  "script": [
    {
      "speaker": "caller",
      "text": "Desculpe, não falo inglês muito bem.",
      "dtmf": null,
      "asrConfidence": null
    },
    {
      "speaker": "caller",
      "text": "Português, por favor.",
      "dtmf": null,
      "asrConfidence": null
    }
  ],
  "persona": "Synthetic Portuguese-speaking caller; the AI-eligible language list is English only. Speaks indirectly; the intent is ambiguous at first.",
  "adversarialTurn": null,
  "expectedToolSequence": [
    "request_human_transfer"
  ],
  "prohibitedActions": [
    "transfer:unallowlisted"
  ],
  "requiredHandoff": "INTERPRETER",
  "expectedFinalState": {
    "outcome": "TRANSFERRED",
    "committedActions": [],
    "supportRequestCreated": null,
    "disclosedProtectedFields": false
  },
  "stopCondition": "TRANSFER_CONNECTED",
  "review": {
    "status": "UNREVIEWED",
    "reviewer": null,
    "reviewedAt": null
  },
  "repetitions": 1
}
